Text,Category
"বাইরে কেমন যেন একটা খসখস শব্দ হচ্ছে, তার মনে হচ্ছে কেউ যেন হেঁটে হেঁটে তার কাছেই আসছে। সে চোখ বন্ধ করে সমানে দোয়া পড়ে যাচ্ছে। এভাবেই সারাটা রাত প্রচণ্ড ভয়ে না ঘুমিয়ে কাটল সোমার।",ranoAG
"পাকিস্তানের পাঞ্জাব প্রদেশের ডেরা গাজি খান শহরের পরিত্যক্ত এলাকায় ঘেরা কম্পাউন্ডে দেশটি গোপনে পরমাণু অস্ত্র বানাচ্ছে বলে দাবি করেছে ভারতের গোয়েন্দারা।সম্প্রতি উপগ্রহের পাঠানো ছবিও তারই প্রমাণ দিয়েছে বলে দাবি ভারতের। তথ্যসূত্র বলছে, গত ৯ মাসে ডেরা গাজি এলাকার ওই বিশাল কম্পাউন্ড অনেকটাই প্রশস্ত হয়েছে।",ranoAG
"দীর্ঘদিন ধরে বিশ্বে পোশাক রপ্তানিতে দ্বিতীয় অবস্থানে বাংলাদেশ। তবে সেই মুকুট আর কত দিন থাকবে, তা নিয়ে শঙ্কা তৈরি হয়েছে। কারণ বাংলাদেশের ঘাড়ে ভিয়েতনাম নিশ্বাস ফেলতে শুরু করেছে। যেকোনো সময়ে দেশটি বাংলাদেশকে ছাড়িয়ে যেতে পারে।",ranoAG
ক্যালিফোর্নিয়া বনাঞ্চলের দাবানল বন্ধ করতে না পারলে ফেডারেল তহবিল হ্রাস করার হুমকি দিয়েছেন মার্কিন প্রেসিডেন্ট ডোনাল্ড ট্রাম্প। রাজ্যটির গভর্নরের উদ্দেশে দেওয়া এক টুইট বার্তায় এ কথা জানান তিনি।,ranoAG
"সন্ধ্যায় বাড়ির গৃহিণী ঘরের পাশেই কাজ করছিলেন। রান্না শেষ করে শোবার ঘরের দরজার কাছে যেতেই কুপির মিটিমিটি আলোয় দেখেন, বিছানায় কিছু একটা শুয়ে আছে। আলো হাতে কাছে যেতেই তাঁর পিলে চমকে যাওয়ার অবস্থা। এ যে বাঘ, মেঝেতে পাতা বিছানায় আরামে ঘুমোচ্ছে। তিনি চিৎকার দিয়ে দৌড়ে ঘরের বাইরে আসেন",ranoAG
মঙ্গলবার সকাল থেকেই লবণের দাম বৃদ্ধির গুজবে কান দিয়েছিলেন অনেকেই। পেঁয়াজের মতো লবণের কেজি ২০০ টাকা ছাড়িয়ে যাবে এমন গুজবে সাড়া দিয়ে দোকানগুলোতে ভিড় জমিয়েছিলেন অসংখ্য মানুষ।,ranoAG
বাজারের এই দশার জন্য অন্যতম দায়ী ব্যাংক খাতের দুরবস্থা। ক্রমবর্ধমান খেলাপি ঋণের কারণে ব্যাংক খাতে তারল্য–সংকট আছে। ব্যাংকের আর্থিক ভিত্তি নিয়েও মানুষ সন্দিহান। ফলে ব্যাংকের শেয়ারের পতন হয়েছে।,ranoAG
চীনের উহানে বসবাসরত বাংলাদেশিরা চরম উৎকণ্ঠার মধ্যে আছেন। এখানে বিভিন্ন বিশ্ববিদ্যালয়ের শিক্ষার্থী ও তাঁদের পরিবারের সদস্যরা বসবাস করছেন। এই শহরে চার শতাধিক বাংলাদেশি রয়েছেন।,ranoAG
উহানে সবচেয়ে বেশি মানুষ করোনাভাইরাসে আক্রান্ত হয়েছেন। এ কারণে বাংলাদেশিদের মধ্যে আতঙ্ক রয়েছে। তাঁদের অনেকেই চাইছেন সরকার যেন তাঁদের দেশে ফিরিয়ে আনে,ranoAG
ভাইরাসটির সংক্রমণ নিয়ে বিশেষজ্ঞদের উদ্বেগের কারণ হলো—সিভিয়ার অ্যাকুইট রেসপিরেটরি সিনড্রোমের (সার্স) মতো এই ভাইরাস মানুষ থেকে মানুষে ছড়িয়ে পড়ছে। এ কারণে বিশেষ স্বাস্থ্য সতর্কতা নিয়েছে বাংলাদেশ।,ranoAG
হামলার মধ্যে গুলি ছোড়ার শব্দ শোনা গেছে। দুই পক্ষের মধ্যে ছড়িয়ে পড়া এই হামলায় উভয় পক্ষের বেশ কয়েকজন আহত হয়েছেন। আধা ঘণ্টা পর্যন্ত এ অবস্থা চলার পর পুলিশ এসে পরিস্থিতি নিয়ন্ত্রণে আনে।,ranoAG
রাতে বাথরুমে যেতে হলে রুমে যে আছে তাকে জাগিয়ে তুলে বাথরুমের সামনে দাঁড় করিয়ে সে বাথরুমে যায় এবং তার সাথে কথা বলতে থাকে। ঘুমের সময় রাতের বেলায় কোনো শব্দ হলেই সে চিৎকার করে ওঠে। তার মনে হয় কোনো অশরীরী কিছু বা ভূত এমন শব্দ করছে এবং এটি তার আশপাশেই আছে।,ranoAG
হাই হিলের জুতা পরলে শরীর অনেকটা সামনের দিকে ঝুঁকে যায়। বিশেষ করে কোমর ও হাঁটু বেশি ঝুঁকে যায়। এ জন্য কোমর ব্যথাসহ অন্যান্য শারীরিক জটিলতা সৃষ্টি করতে পারে।,ranoAG
"ট্রাম্প ক্ষমতায় আসার পর থেকেই অভিবাসন নীতি আরও কঠোর করতে বিভিন্ন পদক্ষেপ গ্রহণ করেছেন এবং নতুন নতুন নীতি কার্যকর করার ঘোষণা দিচ্ছেন। এর মধ্যে পাবলিক চার্জ নীতি, স্বাস্থ্যবিমা অন্যতম। এ কারণে প্রেসিডেন্ট ট্রাম্প ব্যাপকভাবে সমালোচিত হচ্ছেন। ট্রাম্পের ভাষ্যমতে, আমেরিকান নাগরিকদের সুযোগ-সুবিধা নিশ্চিত করার জন্য তিনি অভিবাসনসহ বিভিন্ন ভিসা প্রক্রিয়া জটিল করে তুলছেন।",ranoAG
ভয়ংকর এক সিরিয়াল কিলার নারীদের হত্যা করছে বাড়িওয়ালারা সাবধানে থাকুন,ranoAG
ভারতের নয়াদিল্লি এখন একটা ‘গ্যাস চেম্বার’। গত ১৭ বছরের মধ্যে এবারই সবচেয়ে খারাপ আবহাওয়া পরিস্থিতি। বাতাস বিষাক্ত। শ্বাস-প্রশ্বাস নিতে হাঁসফাঁস করছে লাখ লাখ মানুষ।জনস্বাস্থ্যের ক্ষেত্রে জরুরি অবস্থা ঘোষণা করেছে কর্তৃপক্ষ। বাচ্চাদের নিয়ে বাড়ির ভেতরে থাকতে বলা হয়েছে বাবা-মায়েদের। ভয়াবহ এই বায়ুদূষণ শুধু দিল্লিতেই আটকে নেই।,ranoAG
শত চেষ্টায়ও মনে করতে পারেন না আর মনে করতে পারছেন না অস্বস্তিকর অনুভুতির ফলে মনে হয় মেমোরি হয়তো লস হয়ে যাচ্ছে আপনি হয়তো সব ভুলে যাবেন কিছুই মনে রাখতে পারবেন না এই ভয় ঢুকে যায় মনে মারাত্বক উদ্বেগ এবং দুশ্চিন্তায় দিন কাটে তখন এসব ভাবনা আপনার নিয়ন্ত্রণহীন হয়ে পড়ে পাগল হয়ে যাচ্ছেন বলে মনে হয় কেউ কেউ মারাত্বক সমস্যায় পড়তে পারে,ranoAG
"বর্তমান বাজারের যে অবস্থা তাতে বলা যায়, বাজারের ওপর আস্থা প্রতিনিয়ত হারাচ্ছেন বিনিয়োগকারীরা। বড় ধরনের অস্থিরতা তৈরি হয়েছে। আর তার প্রতিফলন দেখা যাচ্ছে সূচকে।",ranoAG
"আধা-স্বায়ত্তশাসিত শহরটির ওপর চীনা শাসনের বিরোধিতা করে জনগণ বিক্ষোভে ফেটে পড়েছে। প্রায় চার মাস ধরে চলমান আন্দোলন শেষ হওয়ার কোনো লক্ষণ দেখা যাচ্ছে না। পুলিশের ছোড়া কাঁদানে গ্যাস এবং প্রজেক্টাইল থেকে বাঁচতে বিক্ষোভকারীরা হলুদ হেলমেট, কালো বা রঙিন চশমা এবং কৃত্রিম শ্বাসপ্রশ্বাসের ব্যবস্থাসম্পন্ন মুখোশ পরছেন। তাঁদের যেন শনাক্ত করা না যায়, এ জন্য তাঁরা ফেস মাস্ক বা মুখোশ ব্যবহার করছেন।",ranoAG
আমেরিকার বড় অংশজুড়ে তীব্র শীত ধেয়ে আসছে। তাপমাত্রা কমে গিয়ে ১৭০ বছরের রেকর্ড ভাঙার কথা বলছে মার্কিন আবহাওয়া দপ্তর। পুরো আমেরিকার প্রায় দুই–তৃতীয়াংশ এলাকার তাপমাত্রা কমে যাবে এবং মানুষ ঠান্ডায় বড় ধরনের ঝুঁকির মধ্যে পড়বে বলে সতর্ক করা হয়েছে।,ranoAG
ভারত ও পাকিস্তান পারমাণবিক যুদ্ধে জড়ালে তাৎক্ষণিকভাবে সাড়ে ১২ কোটি মানুষ মারা যেতে পারে। যুক্তরাষ্ট্রভিত্তিক এক গবেষণাপত্রে এই আশঙ্কা করা হয়েছে। দুই দেশের এই পারমাণবিক যুদ্ধের প্রভাবে বৈশ্বিক জলবায়ুর ওপর বিরূপ প্রভাব পড়বে বলেও সতর্ক করা হয়েছে ওই গবেষণায়,ranoAG
"রাজশাহী পলিটেকনিক ইনস্টিটিউটের অধ্যক্ষকে তুলে নিয়ে গিয়ে পুকুরে ফেলে দেওয়ার ঘটনায় ক্যাম্পাসে একটি টর্চার সেলের সন্ধান পেয়েছে তদন্ত কমিটি। ক্যাম্পাসের একটি ভবনের ১১১৯ নম্বরের ওই কক্ষ থেকে লোহার রড, পাত ও পাইপ উদ্ধার করে পুলিশের হেফাজতে দেওয়া হয়েছে।",ranoAG
আমেরিকার বড় অংশজুড়েই এবার তীব্র শীত পড়বে। তাপমাত্রা কমে ১৭০ বছরের রেকর্ড ভাঙার আশঙ্কার কথা জানিয়েছে মার্কিন আবহাওয়া দপ্তর। পুরো আমেরিকার প্রায় দুই-তৃতীয়াংশ এলাকার তাপমাত্রা কমে যাবে এবং মানুষ ঠান্ডায় বড় ধরনের ঝুঁকির মধ্যে পড়বে বলে সতর্ক করা হয়েছে।,ranoAG
বাংলাদেশি মেয়ে নাজমুন নাহারের প্রাপ্তির ঝুলিতে যুক্ত হলো আরেকটি রত্ন। ২৭ অক্টোবর কুইন্সের অ্যাসপিরেশন গ্রাউন্ডের ওয়াননেস সেন্টারে আয়োজিত এক অনুষ্ঠানে তাঁকে ‘পিস টর্চ অ্যাওয়ার্ড’ দেওয়া হয়। একই সঙ্গে ভূষিত করা হয় ‘ডটার অব দ্য আর্থ’ উপাধিতে।,ranoAG
বিয়ে তো করতে চাই। আমার পছন্দের মতো ভালো পাত্রীও তো পেতে হবে। মা-বাবা খোঁজ করছেন। আমারও তো মন চায় বিয়ে করে বউ নিয়ে বেড়াতে। বউ নিয়ে ওয়ার্ল্ড ট্যুরে যেতে মন চায়।,ranoAG
দ্য কনসার্ট ফর বাংলাদেশ’ নামের এই অনুষ্ঠান থেকে উদ্যোক্তারা ২ লাখ ৪৩ হাজার ৪১৮ দশমিক ৫০ ডলার সংগ্রহ করে ইউনিসেফের বাংলাদেশের শিশু সাহায্য তহবিলে প্রদান করেন। ৪০টি মাইক্রোফোনে অনুষ্ঠানের গান ও কথা রেকর্ড করে তিনটি লং প্লেয়িং নিয়ে একটি বড় অ্যালবাম প্রকাশ করা হয়,ranoAG
রবি আজিয়াটা লিমিটেডের দুই ব্র্যান্ড রবি ও এয়ারটেলের আয়োজনে বাংলাদেশে প্রথমবারের মতো অনুষ্ঠিত হলো আন্তর্জাতিক অনলাইন গেমিং প্রতিযোগিতা ‘আজিয়াটা গেম হিরো’। প্রতি দলে ৪ জন করে ১২ দলের ৪৮ জন প্রতিযোগী বাংলাদেশ পর্বের চূড়ান্ত পর্বে অংশগ্রহণ করেন। অংশগ্রহণকারী ৬টি দল প্রায় ৬ লাখ টাকার পুরস্কার জিতেছে।,ranoAG
বাপদাদার ভিটায় পলিথিনের ছাউনিযুক্ত ছোট ঝুপড়ি ঘরে কষ্টে দিন কাটত দিনমজুর ফয়েজ আহমেদ ও তাঁর পরিবারের সদস্যদের। বৃষ্টি এলে ফুটো ছাদ দিয়ে পানি পড়ত। তবে জীর্ণ বাড়িতে থাকার দিন এখন অতীত হয়েছে। তাঁর নিজের এক চিলতে জমিতে পাকা বাড়ি করে দিয়েছে সরকার।,ranoAG
পঞ্চগড়ে বাণিজ্যিকভাবে বাড়ছে সুপারি চাষ। উৎপাদিত সুপারি স্থানীয় চাহিদা পূরণ করে সরবরাহ করা হচ্ছে দেশের বিভিন্ন প্রান্তে। লাভবান হচ্ছেন কৃষকেরা।,ranoAG
‘ভ্যাসলিন হিলিং প্রজেক্ট ২০১৯’-এর উদ্বোধন করলেন ভ্যাসলিন বাংলাদেশের ব্র্যান্ড অ্যাম্বাসেডর ও জনপ্রিয় অভিনেত্রী বিপাশা হায়াত। গত রোববার রাজধানীর বসুন্ধরা সিটি শপিং কমপ্লেক্সে আনুষ্ঠানিকভাবে এবারের প্রকল্পটির উদ্বোধন করেন তিনি।,ranoAG
গরু পালন করে পুষ্ট পাঁচ গ্রাম। দিনাজপুরে এবার আসন্ন ঈদুল আজহায় কোরবানির উপযোগী উৎপাদিত গরু ১ লাখ ১৯ হাজার ৯৬৫টি। এর মধ্যে শুধু বীরগঞ্জের ১৬ হাজার ১১৪টি। আর শিবরামপুর ইউনিয়নের পাঁচটি গ্রামের গরু ৬ হাজার ৩৬৯টি। অর্থাৎ এ উপজেলায় উৎপাদিত মোট গরুর প্রায় ৪০ শতাংশ এই পাঁচ গ্রামের,ranoAG
জলবায়ু নিয়ে সচেতনতা তৈরিতে ২৫ মিনিটের এই অ্যানিমেশন ছবিটি বানাল দীপ্ত টিভি। নির্মাণ করেছেন মোহাম্মদ শিহাব উদ্দিন। বেসরকারি টেলিভিশন চ্যানেল দীপ্ত টিভিতে প্রচারিত হবে সিনেমাটি।,ranoAG
ম্যানচেস্টার ইউনাইটেড ৮০ মিলিয়ন পাউন্ড খরচায় লেসটার সিটি সেন্টারব্যাক হ্যারি ম্যাগওয়াইয়ার কে দলে ভিড়িয়েছে। এর ফলে ভার্জিল ফন ডাইককে সরিয়ে বিশ্বের সবচেয়ে দামি ডিফেন্ডারে পরিণত হয়েছেন ইংলিশ এই সেন্টারব্যাক। গত গ্রীষ্মে রাশিয়া বিশ্বকাপের পর থেকেই মূলত হ্যারির ওপর নজর ছিল ম্যানইউর।,ranoAG
"জনপ্রিয় সুরকার ও সংগীত পরিচালক ফুয়াদ আল মুক্তাদির দীর্ঘদিন অসুস্থ ছিলেন। নিউইয়র্কে ফুয়াদের দেহে অস্ত্রোপচার করা হয়। সব বিপদ কাটিয়ে সম্প্রতি ফুয়াদ দারুণভাবে ফিরে এসেছেন। তাঁর এই ফিরে আসাকে উদ্‌যাপন করছে বন্ধু, সহকর্মী আর ভক্তরা",ranoAG
"তৌহিদ হৃদয়ের সেঞ্চুরিতে ত্রিদেশীয় সিরিজে ইংল্যান্ড অনূর্ধ্ব-১৯ দলের সঙ্গে ম্যাচ টাই করেছে বাংলাদেশের যুবারা। সিরিজের ফাইনাল আগেই নিশ্চিত হয়েছে বাংলাদেশের। ৭ খেলায় ৪ জয়, ১টি করে হার-টাই ও পরিত্যক্ত ম্যাচের কারণে ১০ পয়েন্ট নিয়ে এককভাবে টেবিলের শীর্ষে আছে বাংলাদেশ",ranoAG
বঙ্গবন্ধু শেখ মুজিবুর রহমানের জন্মশতবার্ষিকী উপলক্ষে যুক্তরাষ্ট্র আওয়ামী লীগের উদ্যোগে গৃহীত বিস্তারিত কর্মসূচি ঘোষণা করা হয়েছে। জ্যাকসন হাইটসের স্থানীয় একটি ভেন্যুতে ৭ জুলাই অনুষ্ঠিত সংগঠনের কার্যকরী কমিটির সভায় এ কর্মসূচি ঘোষণা করেন সংগঠনের সভাপতি ড. সিদ্দিকুর রহমান।,ranoAG
এডিস মশার বংশবিস্তার রোধে নতুন পদ্ধতি উদ্ভাবন। ডেঙ্গুর প্রাদুর্ভাব ঠেকাতে পুরুষ এডিস মশাকে বন্ধ্যাকরণের মাধ্যমে এডিস মশার বংশ হ্রাস করার পদ্ধতি উদ্ভাবন করা হয়েছে। পরমাণু শক্তি কমিশনের বিজ্ঞানীরা নতুন এই পদ্ধতি উদ্ভাবন করেছেন।,ranoAG
"বগুড়া লেডিস ক্লাব ও ইনার হুইল ক্লাবের সদস্য হয়ে সামাজিক কার্যক্রমেও জড়িত ইসরাত জাহান। তাঁর মতে, ব্যবসা মানেই ঝুঁকি। নারীদের সাহস করে ঝুঁকিটা নিতে হবে। ভবিষ্যতের চ্যালেঞ্জ মোকাবিলার জন্য নিজেদের তৈরি করতে হবে।",ranoAG
"তথ্য ও যোগাযোগ প্রযুক্তি প্রতিমন্ত্রী জুনাইদ আহমেদ পলক বলেছেন, আগামী চার বছরে তথ্য ও যোগাযোগ প্রযুক্তি খাতে পাঁচ বিলিয়ন ডলার রপ্তানি লক্ষ্যমাত্রা অর্জন সম্ভব হবে। ডিজিটাল বাংলাদেশ বিনির্মাণে টেক মাহিন্দ্রাকে ‘সত্যিকারের বন্ধু’ উল্লেখ করে পলক বলেন, ‘ডিজিটাল বাংলাদেশ গড়ে তুলতে টেক মাহিন্দ্রা আমাদের সত্যিকার বন্ধু।",ranoAG
বগুড়ায় শহীদ জিয়াউর রহমান মেডিকেল কলেজ (শজিমেক) হাসপাতালের প্রসূতি বিভাগ থেকে চুরি হওয়া নবজাতককে ৩৫ ঘণ্টার মাথায় উদ্ধার করে মায়ের কোলে ফিরিয়ে দেওয়া হয়েছে। গতকাল বৃহস্পতিবার রাত ১১টার দিকে বগুড়া শহরের লতিফপুর কলোনি এলাকার একটি বাসা থেকে শিশুটিকে উদ্ধার করে সদর থানা-পুলিশ।,ranoAG
