Text,Category
"বিবাহের জন্য যখন কেউ বলে 'একটা ভাল ছেলের খোঁজ পাওয়া গেছে', তখন সেটার অর্থ আসলে 'ভাল অবস্থায় থাকা একটা ছেলের খোঁজ পাওয়া গেছে'। ভাল অবস্থায় থাকা সেই ছেলেটি আসলেই 'ভাল' কি না সেই খোঁজ কিন্তু পাওয়া যায়নি।",ranoAG
"সস্তার তিন অবস্থা' কথাটা অনেকেই ব্যবহার করেন। তাঁরা কি কেহ বলতে পারবেন তিনটা অবস্থা কী কী?  কঠিন, তরল ও বায়বীয় নাকি অন্য কিছু? ",ranoAG
"বাঙালি - - একটা বয়স পর্যন্ত তরুণ সেজে থাকতে কয়েক বছর বয়স কমিয়ে বলতে পছন্দ করে, 'না, আমার আর কী এমন বয়স হয়েছে?...  - একটা বয়সের পর একটু জ্ঞানী ভাব ধরতে কয়েক বছর বয়স বাড়িয়ে বলতে পছন্দ করে, 'হুঁ হুঁ বাবা, অনেক দেখেছি, বয়স তো আর কম হল না",ranoAG
এই মহাবিশ্বে এ যাবত তৈরী সবচাইতে গুরুত্বপূর্ণ সফটওয়ারটির নাম মাইক্রোসফট এক্সেল।,ranoAG
"অথচ আরো হাজারো উদ্ভট নামে ফেইসবুক আইডি রয়েছে, সেগুলো নিয়ে কিন্তু কখনো ট্রল হতে দেখিনা। আসলে এখানে স্টাটাস একটা ফ্যাক্ট। ",ranoAG
এক পার্সোনাল ফাইনান্স ম্যানেজমেন্ট শীট বানাইতে কত বিনিদ্র রজনী কাটাইছি। অতল তলে হাবুডুবু খাইছি। বানাইছিও। এখন সব ছেড়েছুড়ে এখন ডায়েরীতে লিখি। ফর্মুলা ঘাঁটতে ঘাঁটতে সব ভজকট পাকাই গেছে। এটা বানাইতে কয়জনের টীম কাজ করছে? এরা কি আমাদের মত দেখতে?,ranoAG
"আপনি ১০০% ঠিক বলেছেন। আমি কাবুলে বাংলাদেশের পতাকা উড়াই যেদিন বাংলাদেশ দল ক্রিকেট খেলে। কারণ আমি বাংলাদেশী, এই পতাকা আমার। ",ranoAG
"ছবি দুইটার মধ্যে গোলমাল আছে। চিন্তার বিষয়, ভাল করে দেখতে হবে",ranoAG
"একটা ছক্কা মারল ব্যাটসম্যান, চারটা ক্যামেরার চারটা ভিউ থেকে চার বার সেটার রিপ্লে দেখাল টিভি। তাতে রান কিন্তু চার-ছয় চব্বিশ হয়ে গেল না, ছয়ই থাকল। একটা চাকরি/ভর্তি/অর্জন হল আপনার, সেটার প্রাপ্তি থেকে শুরু করে নিয়ে কাজটা শুরু করা পর্যন্ত একই কুমির ছানার গল্প কয়েক ধাপে বার বার শোনালেন ফেসবুকে, তাতে কিন্তু অর্জন অনেকগুলো হয়ে গেল না, একটাই থাকল।",ranoAG
ফেসবুক গ্রুপের এডমিনগুলু যেন শ্রেষ্ঠ পরীক্ষা পাশকৃত মেধাবি এডমিন খেডার। খালি খমতার বড়াই,ranoAG
"তাসনিমের জন্য যে ফান্ড রেইজ করছিলাম মনে আছে? ব্লাড ক্যান্সারের সঙ্গে লড়াইরত তাসনিম? তাসনিমের আজ জন্মদিন। এই রকম চিকিৎসা চলাকালীন সময়ে মানসিক অবস্থা যেমন থাকার কথা, তাসনিমের তেমনই আছে। ওর সঙ্গে কয়েকদিন আগে যখন কথা হল, জানতে চাইলাম - কেমন আছ? তাসনিম বলল, যেমন থাকার কথা। এই ভাল, এই খারাপ।",ranoAG
 সবই তো বুঝলাম কিন্তু। চশমাটা নাকের উপরে ক্যান,ranoAG
"সামারের উইকেন্ডগুলোতে ক্লান্তি দূর করার বদলে আরও ক্লান্তি জমিয়ে সপ্তাহ শুরু করি। ক্লান্তি নিয়ে শুরু করে সপ্তাহের শুরুতে কাজ শুরু করতে আলসেমি লাগে। মনে হয়, শুরু করলেই তো হয়ে যাবে, একটু পর শুরু করি। আলসেমি কাটতে কাটতে কীভাবে যেন শুক্রবার চলে আসে আবার! আবার চক্রের শুরুতে ফেরত যাই। ",ranoAG
ব্রাদার/সিস্টার ফ্রম এনাদার মাদার - আবেগঘন কথাটা বলে ফেসবুকে দুটু লাইক কামাতে পারলেও ভেবে দেখুন কথাটার আক্ষরিক অর্থ হচ্ছে - আপনার পিতার চরিত্র খারাপ,ranoAG
বিষয়গুলো এমনভাবে কখনোই ভাবি নাই ৷ আসলেই আমাদের সমাজের মানুষগুলো এমন! ,ranoAG
"এদিক থেকে আশা করি তালাকের চিন্তা মাথায় আনতে হবে না আমার কারণ তোমার ভাবি আর আমার গরম-ঠান্ডা জনিত বিরোধ তেমন একটা নাই, তবে খাওয়াদাওয়া শুরু করলে উনার এসি অফ করন লাগে, এইটাই একটু ইয়ে আর কি",ranoAG
ডীপ ফ্রীজে ডিম রাখলে এমনি হবে,ranoAG
বাঙালি একসময় জ্বলে পুড়ে মরে ছারখার হলেও মাথা নোয়াবার ছিল না। বাঙালি এখন জ্বলে পুড়ে মরে ছারখার হলেও বালপাকনামি বন্ধ করার নয়।,ranoAG
"পরিবর্তনে আমাদের এক আমূল অনীহা। তবে বিচার বিভাগ যে স্বাধীন, এই রায় তার জ্বলন্ত প্রমাণ।",ranoAG
অহংকার করবেন না। অহংকার করা একমাত্র আল্লাহ পাকের সাজে,ranoAG
ফেসবুক ভালোভাবে ইউজ করতে না পারায় অনেকেই অনেক রকম প্রবলেম ফেস করেন। শুধু তাদের জন্য একেবারে লো রেটে ফেসবুকের যে যেকোন সমস্যার সমাধান করে দিব ইনশাআল্লাহ। (শুধু হ্যাকিং বাদে ) এক কথায় ফেসবুকের যেকোন কাজ করে দিব। আগ্রহীরা কমেন্ট না করে সোজা ইনবক্স করুন। আগে কাজ করে দিব। পরে টাকা দিয়েন। এখানে প্রতারিত হবার কোনো চান্স নাই।,ranoAG
নাস্তিকতার কোন নৈতিকতা নেই। তাই তারা সমাজে অনৈতিক কাজে লিপ্ত। এদের জীবন যেমন হয় ছন্নছাড়া তেমনি হয় হা হুতাশে ভরপুর। এদেরকে বয়কট করুন।,ranoAG
"এক সময় চেহারায় সান্সক্রিম ব্যবহার করতাম। প্রডাকশন বয় থাকতো অন্তত দু’জন যারা ছাতা আর চেয়ার নিয়ে সঙ্গেই থাকতো। কিন্তু নিরাপদ সড়কের আন্দোলনে নেমে সব ভুলেছি। আজ আমি নিজেই চাই ছাতা হয়ে সবাইকে নিরাপদে কিভাবে রাখা যায় সে কাজটি করতে। চেহারার মায়া ভুলেছি ওই্ একটাই কারণ নিরাপদ সড়ক চাই, একটি প্রাণও যেন অকারণে ঝড়ে না পড়ে কারণ একটি প্রাণও দেশের সম্পদ। কোন কারণেই যেন আমার দেশের এই সম্পদ ঝড়ে না পড়ে। ",ranoAG
শুভ জন্মদিন সালমান শাহ.....সে এমন একজন ছিল.... তাকে ভুলে যাওয়ার মত কোন সুযোগ নাই....আছে থাকবে আমাদের.... অন্তরে অন্তরে...,ranoAG
 সালাম তোমায়,ranoAG
"মৌলিক গান করে জনপ্রিয় হওয়া খুব কঠিন, আর পুরনো গান রিমেক করে জনপ্রিয় হওয়াটা খুব সহজ। মৌলিক কাজ করে জনপ্রিয় হতে হলে চাই মেধা এবং অধ্যাবসায় এবং কিছুটা ভাগ্যেরও সহায়তা। সেখানে পুরনো কাজ রিমেক করার ক্ষেত্রে একটা ইন্সট্রুমেন্ট আর মোটামুটি গাইতে পারলেই চলে। ফেসবুকে একটা ভিডিও, ব্যাস। মানুষ যতটা না নতুন শিল্পীর জন্যে গান শুনেন তার চেয়ে অনেক বেশি শুনেন সেই পুরনো সুর নতুন করে খুঁজে পেতে। এতে করে সহজে জনপ্রিয়তা পাওয়া গেলেও নিজের শিল্পীসত্তার কোন বিকাশ হয় না।  যে পুরনো গান নতুন করে গায়, সে তো জাস্ট রেওয়াজ করে গানের। কিন্তু যে নতুন গান সৃষ্টি করে, জনপ্রিয় হোক আর না হোক, আসল শিল্পী তো সে-ই।",ranoAG
 মজার একটা লিমিট থাকা উচিৎ... যাদের রেমিট্যান্সেরর টাকায় দেশ চলে তারাই সব চেয়ে বেশি অপদস্থ ও অন্যায়ের স্বীকার হয় এদেশে.।,ranoAG
বেলজিয়াম দারুন টিম কিন্তু বড় ম্যাচের চাপটা নিতে পারল না।,ranoAG
সরাসরি গালি লিখেন যিনি - অশ্লীল। গালির দুটু বর্ণ ** দিয়ে ঢেকে দেন যিনি - সুশীল।,ranoAG
বৃহত্তর খেনাডার কেন্দ্রীয় সরকার গাঁজার বৈধতা প্রদানের পর এবার বৃহত্তর খেনাডার অন্টারিও শাখার নবনির্বাচিত সরকার এক ক্যান বিয়ারের মূল্য সোয়া এক খেনেইডিয়ান দিরহাম হইতে এক খেনেইডিয়ান দিরহামে নামাইয়া আনিলেন। শেষ খবর পাওয়া পর্যন্ত পিনিক-প্রেমী যুবসমাজ দলে দলে বৃহত্তর খেনাডায় তশরিফ রাখিবার ইচ্ছা প্রকাশ পূর্বক ভিসার জন্যে লাইনে দাঁড়াইয়াছেন।,ranoAG
বর্তমান উন্নয়ন বোর্ডে জব করা আমার চাচাও খুব ভালো ফুটবল খেলতেন। পুরো ঘর জুরে কি সব মেডেল এখনও পড়ে আছে।,ranoAG
"ছেলেরা না পারলেও, কিভাবে জিততে হয় দেখিয়ে দিল বাংলাদেশের মেয়েরা! নারী ক্রিকেটে এশিয়ার চ্যাম্পিয়ন বাংলাদেশ!",ranoAG
আবেগের আর্থিক মূল্য থাকলে কবিরা হতেন পৃথিবীর সবচেয়ে উচ্চবিত্ত শ্রেণী আর ধনীরা হতেন সবচেয়ে নিম্নবিত্ত শ্রেণী।,ranoAG
সব ধরণের খরচ কমিয়ে বেশি সময় ধরে কাজ করতে হবে - বড় হুজুর ইমরান খানের এমন নির্দেশের পর পাকিস্তান শাখার মেধাবীরা পাকিস্তান শাখার শ্রেষ্ঠ পরীক্ষা CSS এর প্রতি আগ্রহ হারিয়ে ফেলছে।,ranoAG
হঠাৎ বিকট শব্দে ট্রেনের হুইসেল শুনি। পরক্ষণেই প্রচণ্ড ধাক্কা।,ranoAG
আলহামদুলিল্লাহ!! এ বছর পাখি ড্রেসের জন্য কেউ সুইসাইড খায়নাই কিন্তু সিম্পললের ভিতর গর্জিয়াস ড্রেসে গা ভাসায় দিচ্ছে,ranoAG
"মনের পশুটি মোটেও ঘাস খেতে চায় না, ভুষিতেও অরুচি। মনের পশুটির রুচি বৃদ্ধিতে কী করা যায় কেহ কি বলতে পারেন?",ranoAG
"পৃথিবীর দীর্ঘতম দীর্ঘশ্বাস জমে আছে যেই বুকে, সেই বুকের মত পবিত্র স্থান আর নেই।",ranoAG
"গতকালকের ঘটনা। রাস্তায় খুব সুন্দর একটা মেয়ে যাচ্ছিল, সামারে কানাডিয়ান মেয়েদের জামা কাপড় একটু ছোটখাটই থাকে, অতি ভদ্র ছেলেদেরও দৃষ্টি সেখানে একটু করে চলে যেতে বাধ্য, আমি তো সেখানে মোটামুটি অভদ্রই। কাজেই আমি তাকিয়ে রইলাম। বউ বলল, এইভাবে তাকায়া আছ ক্যান? কোনদিন মেয়েদের ফিগার দেখ নাই? আমি বললাম, মেয়েদের ফিগার তো দেখছি, কিন্তু এই মেয়েটার টা তো আর আগে দেখি নাই। এই জন্য তাকায়া আছি!",ranoAG
"আমেরিকানদেরই দেখেন, এরা পতাকা দিয়ে কতকিছু বানিয়ে পরে ফেলে তাই বলে কি তাদের দেশপ্রেম কমে যায়? মোটেই না।",ranoAG
"বাবার বোন যদি 'পিসি' হয়, তাহলে মায়ের বোন স্মার্টফোন বা ট্যাবলেট না হয়ে মাসি কেন হবে?",ranoAG
সাইবার ৭১ বলেই ক্লিক করছি। নাহলে করতাম না। ১০১ নাম্বার হব জানতাম তবুও দেখলাম কারণ আমি বিশ্বাস করি সাইবার ৭১ আমার ক্ষতির কারণ হবেনা।,ranoAG
"ফেসবুক মেসেঞ্জার, ইয়াহু মেসেঞ্জার, ভাইবার সহ সকল চ্যাটিং এপস কোম্পানি জানিয়েছে যে, তাঁদের চ্যাট এপসগুলোতে বাল নামক কোন অপশন নেই। অতএব, ""চ্যাট এর বাল"" কথাটি বলা অর্থহীন। এমন অর্থহীন কথা অকারণে না বলতে এক যৌথ বিবৃতিতে কোমলমতি_বেবহারকারীদের তাঁরা পরামর্শ দেন। এই মেসেজটি সবার সঙ্গে শেয়ার করে নিউজফিড চ্যাট_এর_বাল মুক্ত রাখতে তাঁদের সহযোগীতা করুন।",ranoAG
"নোমানরা ওমান না থাকলে এদের ভাত বন্ধ হয়ে যাবে, পেটে ভাত না থাকলে মাথায় ট্রলও আসবে না",ranoAG
"কুরুচিপূর্ণ, অশিক্ষনীয়, আজে-বাজে, ফালতু মার্কা নিউজ না দিয়ে ভাল, গঠনমুলক, শিক্ষনীয়, উপকারী নিউজ দেয়ার জন্য এডমিনকে বিনীত অনুরোধ করছি। আসুন সবাই মিলে ফেসবুকের মান রক্ষা করি, ফেসবুকের যথাযথ মূল্যায়ন করি।",ranoAG
এই একজন নায়ক যে এখনও ভালো লাগা টা রইয়ে গেছে।।শুভ জন্মদিন।।বার বার ফিরে এসো তুমি এই বাংলার নীরে,ranoAG
এই সকল তথাকথিত সেলিব্রিটিদের এই সকল কর্মকান্ড তাদের যারা ভক্ত তাদের উপর প্রভাব পড়ে। এদের যারা ভক্ত তারা মনে করে তাদের আইকন যদি এই রকম কর্ম করতে পারে তাহলে তারাও নিমিষেই এই কর্ম করতে পারে।,ranoAG
নজরুলের সময়ে আমাদের ছিল দুখু মিয়া। আর ফেসবুকের সময়ে এখন আমাদের আছে সুখু মিয়া।,ranoAG
আমাদের দেশের ফুটবল এর অবাস্থা ধারাভাষ্যকারের ধারাভাষ্য শুনলেই খুব ভালো করে বুঝা যায়,ranoAG
পাগলা আর ছাগল মিলে এসব রিপোর্ট বানায় আর বিবিসি বাংলা এসব গুজব রটায়,ranoAG
"সিল্কের পাঞ্জাবী হাতে ভুটকা লোকটা নিশ্চয় আরিব্বাই, এজন্যই এটা নিয়া কোন কথা নাই কিন্তু হ্যাশট্যাগ ঠিকই আছে ",ranoAG
বেশী এবং খুব ভয়ঙ্কর রকম দ্রুত গতিতে বদলাচ্ছে যেন সব,ranoAG
"গ্রেট ব্রিটেনের মত উন্নত দেশের উন্নত সড়ক ব্যবস্থায় রাজ-পরিবারের সদস্য হয়েও যদি প্রিন্সেস ডায়না রোড একসিডেন্টে মারা যান, তাহলে - আপনি কোন চটোকেশ হে?",ranoAG
"আমাদের দেশে গলির মোড়ে মোড়ে, বিল্ডিংয়ের তলায় তলায়, ফ্ল্যাটের ঘরে ঘরে এত এত ফটোগ্রাফার, অথচ তাঁরা কেউ বিশ্ববিখ্যাত ফটোগ্রাফার ডক্টর শহীদুল আলম কে চিনেন না!",ranoAG
"শুভ জন্মদিন প্রিয় প্রিয় এবং প্রিয় সালমান শাহ!! আপনি যেখানেই থাকুন, ভালো থাকুন। আপনার আত্মার মাগফেরাত কামনা করি। আমিন। এবং সাথে এটাও কামনা করি যারা আপনার অকাল মৃত্যু ঘটিয়েছে তাদের এই দুনিয়াতেই যেন শাস্তি হয়, আর আখিরাতের শাস্তি তো থাকবেই। মিস ইউ........!!!!",ranoAG
এরপর থেকে ঈদের আগেই আন্দোলন। - ম্যাডাম।,ranoAG
আর কিছু না হলেও অন্তত মাস্টারবেশনাল স্পিকারদের মুখুশ খুলে দিল কিশোর আন্দোলন।,ranoAG
গার্মেন্টসও ইস্যু দেখে কাপড় তৈরি। বাহ! এই জন্যই বাংলাদেশ এখন স্বল্প উন্নত আয়ের দেশ থেকে মধ্যম আয়ের দেশ। কিছুদিন পর আমেরিকার সাথে টক্কর দিবে। ,ranoAG
অই উকিল চাচার পুলা মনে হয় পতাকা কিনার টাকা চাইছে উনার কাছে এই জন্য টাকা বাচানোর তাগিদে মামলা করে দিছে।,ranoAG
"আজ যেটা গুজব, কাল সেটা গজব।",ranoAG
"অদ্ভুত ভাবে ছুটে চলার নাম ই আধুনিক জীবন । শান্তি না পেয়ে শান্তি খুজতে খুজতে মরে যাবার নামই সভ্যতা , আধুনিকতা। অকুল পাথারে সাতরে সাতরে , পানি পিপাষায় মারা যাবার নামই এখন সফলতা ।",ranoAG
 বিচিলেস পরীক্ষায় পাস করিয়া অনেকে বলে জনগণের সেবা করার সুযোগ পাইলাম। আরে আহাম্মক আমরা ঠিকই বুঝি কি সেবা করিস তোরা। দেশের জিডিপিতে বিন্দু মাত্র অবদান নেই তাদের। উল্টা জনগণের আয়ের ওপর ভাগ বসায়। কিন্তু বন্দনা তারা করবে সরকারের। এরা সরকারের চামচা। দেশের আর দশের কোনো উপকর এদের দিয়ে হয় নাই। হবেও না। এরা এক একটা আগাছা আচোদা।,ranoAG
"ছাত্র-জনতার যৌক্তিক আন্দোলন হলে তথাকথিত মেধাবী সরকারি চাকরিজীবিরা ভাল বিপদে পড়ে যান। এদিকে গেলে চাকরি নিয়ে টানাটানি, ওদিকে গেলে সেলিব্রেটি/মেধাবী খেতাব/লাইক নিয়ে টানাটানি। এ কেমন বি-পোদ? ",ranoAG
"সেই ৪/৫ বছর আগে থেকে শুনে আসছি এখন পর্যন্ত চূড়ান্ত হলো না! এয়ারটেল, রবি, গ্রামীণফোনকে কবেই ছুড়ে ফেলে দিতাম!!",ranoAG
