Text,Category
"আমাদের সেনা বাহিনী তোদের গাঁড়ে বেয়নেট ঢোকাবে আর মুখ দিয়ে বের করবে , তখন আল্লাহ বলেও ডাকতে পারবি না",raAG
আহারে হজরত মোহাম্মদের মতো চুদির বাচ্চা কে অনুসরণ করা নির্বোধ ভাইগুলো রে!,raAG
ইসলাম হলো পৃথিবীর জন্য অভিশাপ। ইসলাম না আসলে পৃথিবী অনেক শান্তিপূর্ণ জায়গা হতো,raAG
ইসলামের উত্পত্তি রক্তপাত হতে,raAG
বাংলাদেশে সব জায়গায় একখনো মুষলিমরা অত্যাচার চালাচ্ছে।,raAG
এই হত্যা করার কথা ইসলামের পবিত্র বই কোরআন শরীফে লেখা আছে।,raAG
শয়তানের বই কোরআন শরীফ যতদিন থাকবে ততদিন হত্যা ও ধর্ষণ চলতে থাকবে।,raAG
ইসলামের নবী মুহাম্মদ নিজে ছিল একজন শিশু ধর্ষক ও ধর্ষক।,raAG
মুসলিমরা এই চরিত্রহীন নবী মুহাম্মদকে অনুকরণ করে ও কোরআন শরীফ অনুসরণ করে। কোরআন শরীফ তাই বন্ধ করা অতি আবশ্যক।,raAG
"প্রথমে ভাবতাম যে কোনো ধৰ্ম হিংসা শেখায় না, কিন্তু কুরআন পড়ে আমার সব ধারণা পাল্টে গেলো....",raAG
"ইসলাম পুরো মানব সমাজের জন্য খতরা, ১৪০০ বছরে নিরিহ মানুষের অনেক ক্ষতি করেছে জঙ্গিরা, এবার এই জেহাদি ইসলামের ধ্বংস চাই ,, ধিঃ",raAG
ঠিক কথা ....... তাই জন্যই তো মুহাম্মদ ওইরকম যন্ত্রণা পেয়ে বিষক্রিয়ায় মরছে আল্লা নাকি বলছে বিয়া বন্ধ ...... তারপরও একেরপর এক বিয়া করছে,raAG
মুহাম্মদ মারা যাবার পর দলে দলে মানুষ ধর্ম ছেড়ে দিয়েছিল কিন্তু আবুবকর খুন করে রক্তের নদী বইয়ে দিয়েছিল ধর্ম ছাড়া যাবেনা বলে মুসলিমদের আবার আদর্শ কি ?,raAG
গায়ে বোমা বেঁধে আল্লা হুঁ আকবর বলে নিরীহ মানুষ হত্যা করা মুহাম্মদ ছিল একটা পুরুষ বেশ্যা একেক রাতে একেকজন বিবির কাছে আবার একসঙ্গে সবগুলার সাথে যৌনক্রিয়া করত আবার তাতেও হইত না দাসী বেটি চাচাতো বোন লাগতো,raAG
আপনে বলেছেন ইসলামের কিছু হবে না ...….. হবে নাইতো ...... পৃথিবীতে লুচ্চা ফেরেকবাজদের সংখ্যাই বেশি আগাছার বৃদ্ধি বেশি সবাই জানে,raAG
কুরআনে কি লেখা আছে ভাই ? সূর্য আল্লার আরশের নীচে লুকায় ? হ্যাঁ  হ্যাঁ  হ্যাঁ  সব হাস্যকর কথা কোরান নাজিল হয়েছিল মক্কা ও তার আশপাশের এলাকার লোকজনের জন্য আরবিতে বাংলার শস্য শ্যামল দেশে এইসব কেন ?,raAG
আল্লার মনোনিত ধর্ম...... মানেটা কি ? সেই আল্লা যে কিনা মুহাম্মদের মাগীর দালাল ছিল ? মরার পর কি বুঝবে ? আপনে মইরা বুঝছেন নাকি নাকি মরার পর কবর থেকে উইঠা কেউ বইলা গেছে ?,raAG
বলেন তো মুহাম্মদের পেশা কি ছিল ? এত্তগুলা মাগীরে আইনা ঘরে জুটাইছিল খাওয়াইছে কি ? পেশা কি ছিল ? খাদিজার ব্যবসা লাটে তুলে ডাকাতি লুটপাট গনিমতের মালের একের পাঁচ ভাগ কমিশন দাস ব্যবসা মানে নিরীহ মানুষ ধইরা বাজারে বেইচা খাইতো ...... ওয়াক থুঃ ....... আপনেরা তার উম্মত আইছেন একজন গনহত্যা কারির হয়ে ওকালতি করতে ...... আন্তরিক ধিক্কার জানাই,raAG
"কোরআন আল্লার বাণী হয় কি করে? মোহাম্মদ নিজে ছিল মূর্খ অশিক্ষিত বর্বর একটা লোক সে যেটা বলে গেছে কোরানে সেটা আল্লার বাণী হয়ে গেল ! বাঃ কি সুন্দর ! মোহাম্মদের স্বভাব ছিল শুয়োরের মত , সব সময় পচা নর্দমার দিকে নজর ছিল",raAG
কোরানের ভুল লিখে গুগুলে সার্চ করেন কোরানের আয়াত ছাগলের খাদ্য হ্যাঁ হ্যাঁ হ্যাঁ ,raAG
কোরআন আল্লার বাণী হতে পারে না । এবং এরপর অনেকবার কোরআন পোড়ানো হয়েছিল এবং নতুন করে লেখা হয়েছিল। তাই নবীজির সময় কার কোরআন আর এখন কার কোরানের মধ্যে কোনো মিল থাকা সম্ভব নয়।,raAG
কোরান লেখা হয়েছিলো সেক্সের গল্প হিসাবে কিন্তু মানুষ এগুলো ধর্মের বই বলে চালিয়ে দিচ্ছে,raAG
মুসলমানরা যখন থেকে ভারতে এসেছে তখন থেকে ভারত অশান্তিতে আছে।মুসলমানরা যেখানে যায় সেই এলাকাকে নিজের বাপের মনে করে হামলা করে।,raAG
আপনাদের আল্লা নিস্কর্মা বদ্ মুহাম্মদের বিয়ে নিয়ে কত্তো উৎসাহ ...... আরও বিয়ে করো ..... তুমি দাসী কেন করবা না .. আমি তোমার জন্য বাঁদি হালাল করেছি সেই আল্লারে নিয়ে আপনারা গর্বিত অত্যন্ত যন্ত্রণা পেয়ে বিষক্রিয়ায় মরার সময় আল্লা উধাও,raAG
চটি বই/ লিখিত পর্ণ = কোরাণ/হাদিস,raAG
এই মুসলিমদের সঠিকপথে আনতে আবার ভগবানকে অবতার নিতে হবে।,raAG
এর জন্যই মুসলিমরা নিজের মেয়েকে ধর্ষন করে জান্নাতে যাওর জন্য নিকৃষ্ট ধর্ম ইসলাম,raAG
মোহাম্মদ ছেলের বউ জয়নফ কে ধর্ষন করে তার বিয়ে করে ৬ বৎসরের শিশু আয়শাকে ৫৩ বৎসরের বুড়া মোহাম্মদ বিয়ে করে শেই ধর্ম কতটা ভাল হবে,raAG
নবী মহম্মদ শুধু নিজ পুত্রবধূ (জয়নবকে) ধর্ষণ করে ক্ষান্ত থাকে নি। নিজ Best Friend আবু বকরের কনিষ্ঠা পাঁচ বছরের শিশু কন্যা আইশা একদিন বাড়ীতে আপন মনে পুতুল লইয়া খেলিতেছিল।,raAG
খাবারের লোভ দেখাইয়া অন্যত্র লইয়া গিয়া মহম্মদ শিশু আইশাকে ধর্ষণ করেছিল।,raAG
"নিজ মাসী খালুয়ার সাথে বিবাহ বহির্ভূত শারিরীক সম্পর্ক স্থাপন, এবং এই মাসীর অকাল মৃত্যুর পরে গোর-স্থানে নামিয়া জেনাজা উলংগ করিয়া মহম্মদ সেই মৃতদেহ বলাৎকার করেছিল। উট-মূত্র পান করেছিল। শিশু মাদী-উট ধর্ষণ করেছিল।",raAG
মুসলিম আর মানুষ দুটি সম্পুর্ণ আলাদা। এরা পৃথিবীর এক অভিশাপ।REPLY,raAG
"ধর্মটা মারামারি, খুনোখুনি, বর্বরতা, ধোঁকা, ধর্ষণ, চোদাচূদি এই সবেতেই প্রাধান্য দেয় । এই ধর্মে আল্লাহ বা ভগবানের উপাসনা, সাধনা করার কথা বলে না । মনে হয় কোরআন অতি নিম্ন শ্রেণীর বিধি উপদেশ দেয় ।",raAG
"ইসলাম কোন ধর্ম নয়, রাজনৈতিক-মতবাদ মাত্র। সমস্ত রকমের নোংরা পদ্ধতি অবলম্বন করে, পৃথিবী-দখল করাই একমাত্র লক্ষ্য ।",raAG
ইসলাম ও কোরান মুহাম্মদ ও খলিফা দ্বারা সৃষ্টি।,raAG
ভাই সত্য খুজতে গিয়ে পেলাম ইসলাম ও কোরান মুহাম্মদ ও খলিফা দ্বারা সৃষ্টি।,raAG
আপনি যদি ভালো করে কোরান বুঝে পড়েন তাহলে আপনি কোরান এর অনেক ভুল পেতেন। এবং বুঝতে পারতেন কোরান ও ইসলাম মুহাম্মদ ও খলিফা দ্বারা সৃষ্টি।,raAG
ছি ছি এতো নির্লজ্জ ছিলো তোদের লুচ্ছা নবী মোহাম্মদ | নিজের ছেলের বউকে বাড়িতে একলা পেয়ে তার সঙ্গে চুদাচুদি |,raAG
"ইসলাম কেমন ধর্ম, যার প্রবর্তক ছিলো একজন বিয়ে পাগলা বুড়ো ?",raAG
"ইসলাম কেমন ধর্ম, যার প্রবর্তকের এতগুলো স্ত্রী থাকা সত্ত্বেও তাকে আরো ৩ জন যৌনদাসী বা রক্ষিতা রাখতে হতো ?",raAG
"ইসলাম কেমন সভ্য ধর্ম, যার প্রবর্তক ৯ বছর বয়সী এক ঋতুচক্রবিহীন শিশুকে (আয়েশা) বিয়ের নামে ধর্ষণ করে ?",raAG
"ইসলাম কেমন ধর্ম, যার প্রবর্তক শুধু যৌনকামনার জন্য নিজের পুত্রবধূকে বিয়ে করে ?",raAG
"ইসলাম কেমন ধর্ম, যার প্রবর্তক একজন খুনী-সন্ত্রাসী ?",raAG
"ইসলাম কেমন নীতির ধর্ম, যার প্রবর্তক ছিলো একজন ডাকাত সর্দার ?",raAG
"ইসলাম কেমন মানবতার ধর্ম, যাতে যুদ্ধের পর পরাজিতদের সম্পদ লুঠ করতে এবং তাদের মেয়েদের বন্দী করে তাদের ধর্ষণ করতে উৎসাহিত করা হয় ?",raAG
"ইসলাম কেমন ধর্ম, যার আল্লা নিজেও লুঠপাটের মালের ভাগ খায় ?",raAG
"ইসলাম কেমন ধর্ম, যাতে পুরুষদেরকে ৪টি বিয়ের অনুমতি দিয়ে মেয়েদেরকে সতীনের সংসারের যন্ত্রণার মধ্যে ফেলে ?",raAG
মোহাম্মদ যতগুলো বিবাহ করেছে তা সেক্স এর জন্যই করেছে | এই হাদিস থেকে এটাই বোঝা যাই |,raAG
ইসলাম চালু করে সবচেয়ে বেশি লাভবান হয়েছে মোহাম্মদ নীজে। মালটা সব রকমের অপকর্ম করে আল্লাহর নির্দেশ বলে চালিয়ে দিছে।,raAG
ইসলাম ধর্ম মানে একাধিক নারী ভোগ এবং নানা ছুতোয় অবিশ্বাসীদের হত্যা। মুসলিম নারীদের উচিত ধর্ম পরিবর্তন করে স্বাধীন হওয়া।,raAG
"এক কাজ কর, ইমাম-এর দাড়ির উকুন বেটে শুয়োরের মাংসের সঙ্গে মিশিয়ে খেয়ে ঘুমিয়ে পড় ।উত্তেজনা কমে যাবে।সকালে আসমান-এর দিকে তাকিয়ে দেখবি, কৃষ্ণ আয়েশার গুহায় ঢালছে আর নবী মহম্মদ হরে কৃষ্ণ হরে রাম বলে নাচছে ।",raAG
"যখন মুহম্মদ খাদিযাকে বিয়া করে তখন খাদিজার অনেক টাকা,সম্পত্তির লোভে মুহম্মদ খাদিজার বিয়া করে,তখন মুহম্মদ খুব গরীব,মন্দিরের দেখাশুনা করত",raAG
এগুলো থেকে বুঝা যায় মুহম্মদ একজন লুচ্চা মেয়ে মানুষ লোভী ছিলেনShow lessREPLY,raAG
সবচাইতে বড় বেঈমানের উপর বিশ্বাস রাখাটাই ইসলামের 'ঈমান'। সবার চাইতে বড় মিথ্যাবাদীর উপর বিশ্বাস রাখাটাই ইমান।,raAG
"আসলে আল্লাহ চরিত্র টি মহম্মদের সৃষ্টি করা, এবং নিজের স্বার্থে আল্লাহ কে ব্যবহার করে ছে মাত্র।।",raAG
নবী মুহাম্মদ আললার নাম দিয়ে নিজ নীচ লোভ ভোগ করেছে। মহিলাদের গনিমতের মাল যত পেরেছে মহিলাদের ভোগ করেছে। এটি কি একটা ধর্ম। জন নাতে নবী মহম্মদ দেখলেন সব মহিলা। মুসলিম মহিলাদের কত নীচে নামিয়েছে,raAG
মহম্মদ ইসলাম ধর্ম গ্রহণ করার জন্য একাধিক নারী ভোগকে টোপ হিসেবে ব্যবহার করেছেন।,raAG
ইসলাম কুনই ধমই না এইটা হইয়েছে বুনুয়াট ধম,raAG
মাদারচোদ তুই একটা জংগ্গী তোদের ধর্মে তোদের জংগ্গী শিক্ষা দে।,raAG
যৌনাচারের সর্গভুমির নামই মহাউন্মাদের ইসলাম । সমাজের নিষিদ্ধ কাজকে লাইসেন্স প্রদান করে গেছে ইসলামের নামে ।,raAG
খানকির পুলা রা ধরমের নামে ব্যবশা করে ওরা মুসলিম হতে পারে না ওরা জংগী,raAG
"ধর্ম ব্যবসা ছাড়া আর কিছুই না এগুলা। দুয়া মোনাজাত করার কথা বইলা পুরা ঢাকা অচল কইরা দিছিলো। লাখ লাখ মানুষ এদের কারনে ভোগান্তি তে পড়ছিলো। শুধুমাত্র এদের কারনে লাখ লাখ মানুষের মত আমার আব্বারও অফিস থেকে বাসায় আসতে অনেক সমস্যা হইছিলো, অনেক ভয়ের মধ্যে ছিলাম আমরা যে উনি সহি সালামতে বাসায় আসতে পারবে কিনা? দেশের শতকরা ৯০ ভাগ মুসলমান , এখনও জুম্মার নামাজ আদায় করতে গেলে মসজিদে জায়গা পাওয়া যায় না, ঢাকা শহরকে বলা হয় মসজিদের শহর। আর এদের কথা শুনলে মনে হয় ইসলাম গেলো।",raAG
"নাউজুবিল্লাহ নাউজুবিল্লাহ নাউজুবিল্লাহ, মুসলিম জাতি এই কাছিম, কে, কিভাবে, পূজা করে,",raAG
চারাল তোদের মত এত নোংরা মানসিকতার মুসলিম রা না তরা নিজের মা কে রেপ করিস গনেস এর টা দেখে সিখছিস,raAG
আপু আপনিতো বেশ এক্টিভ ইসলামকে গালি দেওয়ার ব্যাপারে। বেশি সম্মান দেওয়া হইত তাই নিতে ইচ্ছা করে।পরে আপনাদের মতো নারীরাই বিরুপ নারীবাদ আর ধর্মীয় বিদ্বেষ ছড়াই,raAG
সম্মান সম্মান করে নগ্নতা দেখায়ে যোনি উলঙ্গ করে কি যে সম্মান দেখান।দেবী করে নগ্নতা দেখায়ে ফিলিংস নেন।সম্মান মজা একসাথে না???আর আপনারা হাজারটা বিয়ে করেন নারী সম্মতি ছাড়া সমস্যা নাই আর নারী সম্মতি নিয়ে তিনটা বিয়ে করলেই দোষ। আপনাদের মতো নারীদের জোর করে বিয়ে করলেই জায়েজ হওয়া আমাদের ধর্মে নাই। আর হিন্দু হয়ে জানেন আপনি। নিজের ধর্ম নিয়েই ধারণা নাই আইসে অন্য ধর্মের খুত ধরতে,raAG
"ইসলাম হলো মাদারচোদদের ধর্ম, খানকির ছেলে মোহাম্মদ অতগুলো ফুটো থাকতেও আবার ৫ বছরের আয়েশা কে বিয়ে করেছিল, তারপর ৯ বছরের মাথায় ৫ নম্বর জুতোর সাইজে ১০ নম্বর পা গলিয়ে দিলো তারফল ছিল ছেঁড়া ফাটাযোনি, তোদের ধর্মটাই তো নুনুর ধর্ম রে শুওরেরবাচ্চা, নিজের চরকায় তেল দেরে কাটা কাঙলূর জাত",raAG
পিশাস কতো পোকার৷ মালাওনরা না থাকলে বুঝতামই না।।।,raAG
তুই আর তোর মত অজ্ঞানী মানুষ হচ্ছে বাইনচোদ্।তোদের ধর্ম কি শিখায় কাতলেয়াম্ করা।কেবল আল্লায় বিশ্বাস করতে হবে না হলে কাফের বলা।জোর করে ধর্মান্তকরণ্ করা।নারীকে শুধু ভোগের বস্তুু ভাবা।তোরা হলে জাহান্নমের কীট।তোরা কি বুঝবি এইসব???,raAG
"বেইমানী তোদের রক্ত মাংসে ভরা।তোরা হচ্ছিস মিরজাফর।এই দুনিয়াতে সবথেকে বেশী আতঙ্ক তোরাই সৃষ্টি করেছিষ।লাদেন,দাউদ,বাগদাদী এরা তোদের কোরানের দ্বারা সৃষ্টি করা অপদার্থ জীব।এরাই হচ্ছে ইসলামের আসল মস্তিষ্ক,আসল চেহারা। এই দুনিয়াকে দারুল ইসলাম্ বানানো তোদের সবার অস্তি মজ্জায়",raAG
"তোদের সামনে বাংলাদেশ,পাকিস্তান।ভারতে দি গ্রেট কেলকাটা কিলিং নামে পরিচিত দাঙ্গা,গোধরা ট্রেনে জীবন্ত মানুষদের জালিয়ে দেওয়ার মত ন্যাক্কার জনক গঠনা। ছিঃছিঃছিঃ এরকম হাজারো গঠনা।শালা তোদের আল্লাও তোদের মাফ করবেনা আর যদিও করে তাহলে তোদের ওই আল্লাটাও একটা শয়তান্ ছাড়া আর কিছু নয়",raAG
ছি ছি এই ছিলো মোহাম্মদ এর চরিত্র,raAG
ছি ছি আবার নিজের মেয়ের বয়সি আয়েশা কে জোর করে ধর্ষণ এই যদি তোদের নবীর গুন হয় তাহলে বিশ্বাস কর জেলে গেলে অনেক তোদের নবী পাওয়া যাবে,raAG
ইসলাম হচ্ছে একটা যৌন কামী ধর্ম। এদেরকে থামাতে হলে মাদ্রাসা শিক্ষাব্যবস্থা বদ্ধ করতে হবে। মাদ্রাসায় এদেরকে জিহাদ করায় সকল অমুসলিমদের হত্যা করতে হবে।,raAG
"ইসলামের দৃষ্টিতে মেয়েরা শয়তান, কুকুর ও ঘোড়ার সমতুল্য!",raAG
ধুর সালা মুর্খ। তোরা হজ্জে গিয়ে কি করছ? পুরাটাই জলে।,raAG
সারা বছর চুরি চামারী করে দুনিয়ার সকল সুখ উপভোগ করে মৃতু্ পর ৭২টা হুরের লোভে হজ্জ করা। এর চাইতে ভন্ডামি আর কি হতে পারে?,raAG
মুসলমান মানে হিন্দুদের ধ্বংস করা,raAG
মাসিকের সময় আয়শার গায়ে লিঙ্গ ঘষতেন মুহাম্মদ,raAG
তোদের আল্লাহ কে তো রোজ চুদি আমি।gay চোদা আল্লাহ😂😂,raAG
ইসলামের মতো ঘৃণিত ধর্ম পৃথিবীতে নেই ।,raAG
